{
  "id": "darkwood_forest",
  "name": "Darkwood Forest",
  "description": "A dense, ancient forest where sunlight barely reaches the forest floor. Massive oaks and twisted pines dominate, their roots forming natural pathways. The underbrush is thick with ferns and moss. Wolves howl in the distance, and the occasional glint of eyes watches from the shadows.",
  "defaultTile": "tree",
  "tileWeights": {
    "tree": 0.4,
    "grass": 0.3,
    "floor": 0.1,
    "water": 0.05,
    "wall": 0.15
  },
  "flora": ["ancient_oak", "twisted_pine", "dark_fern", "glowing_mushroom", "moonflower", "ironbark"],
  "fauna": ["wolf", "deer", "bear", "boar", "forest_spider", "owl", "fox"],
  "weatherRules": "temperate_forest",
  "temperatureMin": -5.0,
  "temperatureMax": 25.0,
  "rainfall": 0.7,
  "allowedStructures": ["cabin", "camp", "cave", "ruins", "shrine"],
  "properties": {
    "visibility": "low",
    "danger_level": "medium",
    "magic_presence": "moderate"
  }
}
